news_id,headline,candidate_id,news_source,sentiment,impact_score,publication_date
260,Rashmi Pandey praised for inclusive governance policies,139,Nepal TV,Positive,3.13,2082-04-02
261,Lekh Dahal leads polls in Biratnagar according to latest survey,47,My Republica,Positive,2.56,2082-02-12
262,Narayan Giri's rally draws massive crowd in Kathmandu,65,My Republica,Positive,6.67,2082-03-18
263,Gopal Pradhan embroiled in controversy over employment,29,The Himalayan Times,Negative,4.16,2082-02-18
264,Dipak Pandey files candidacy for Hetauda constituency,34,Nepal TV,Neutral,7.2,2082-03-16
265,Gita Devkota leads polls in Biratnagar according to latest survey,44,Online Khabar,Positive,7.34,2082-03-23
266,Bhuwan Bhusal leads polls in Pokhara according to latest survey,15,The Himalayan Times,Positive,5.2,2082-03-25
267,Rudra Thapa leads polls in Nepalgunj according to latest survey,16,Gorkhapatra,Positive,3.23,2082-04-14
268,Kamal Rokaya's rally draws massive crowd in Bharatpur,179,Avenues TV,Positive,8.55,2082-02-02
269,Yasoda Oli holds press conference on healthcare agenda,197,Nepal TV,Neutral,1.82,2082-03-22
270,Bhuwan Parajuli unveils comprehensive agriculture manifesto,30,Rising Nepal,Positive,5.04,2082-03-10
271,Pradeep Chand participates in all-party debate on agriculture,160,Deshsanchar,Neutral,6.68,2082-02-10
272,Sabina Magar's campaign finances under scrutiny,140,NTV Plus,Negative,7.48,2082-04-08
273,Bina Chaudhary participates in all-party debate on agriculture,70,Nagarik News,Neutral,2.82,2082-04-01
274,Ashok Koirala receives endorsement from education leaders,40,Kantipur Daily,Positive,9.72,2082-04-06
275,Voters rally behind Rajan Dahal for governance agenda,92,The Himalayan Times,Positive,2.0,2082-03-02
276,Roshan Aryal praised for inclusive employment policies,58,Ratopati,Positive,5.07,2082-02-01
277,Shila Airee receives endorsement from education leaders,130,The Himalayan Times,Positive,9.43,2082-03-20
278,Sunita Aryal's rally draws massive crowd in Dharan,35,Gorkhapatra,Positive,6.49,2082-03-11
279,Dil Mahato promises to transform infrastructure in 100 days,181,Nagarik News,Positive,8.42,2082-02-25
280,Om Parajuli files candidacy for Bharatpur constituency,127,Gorkhapatra,Neutral,7.49,2082-03-28
281,Bimal Devkota accused of vote-buying in Kathmandu,5,Deshsanchar,Negative,3.6,2082-02-11
282,Sunita Tiwari declares assets worth NPR 45.8 crore,31,Ratopati,Neutral,2.08,2082-03-31
283,Ganesh Dhakal leads polls in Bharatpur according to latest survey,198,Avenues TV,Positive,1.37,2082-02-02
284,Kamal Rokaya leads polls in Hetauda according to latest survey,179,Avenues TV,Positive,7.54,2082-04-12
285,Shyam Yadav files candidacy for Butwal constituency,18,Deshsanchar,Neutral,2.02,2082-02-10
286,Bhim Thapa promises to transform economy in 100 days,187,Avenues TV,Positive,8.36,2082-02-26
287,Bed Subba holds press conference on education agenda,132,Annapurna Post,Neutral,9.14,2082-04-05
288,Critics question Sunita Aryal's stance on governance,35,Ratopati,Negative,6.69,2082-03-01
289,Top Yadav campaigns in rural Butwal districts,71,Annapurna Post,Neutral,7.67,2082-03-24
290,Govinda Khadka unveils comprehensive employment manifesto,128,Gorkhapatra,Positive,8.64,2082-04-11
291,Election Commission verifies Ek Dhakal's credentials,48,Nepal TV,Neutral,6.16,2082-02-11
292,Bimala Tharu unveils comprehensive governance manifesto,63,Nagarik News,Positive,1.64,2082-04-14
293,Tara Khadka declares assets worth NPR 1.6 crore,134,Rising Nepal,Neutral,5.36,2082-02-16
294,Ram Sapkota's campaign finances under scrutiny,26,Setopati,Negative,2.64,2082-04-14
295,Voters express dissatisfaction with Sumitra Magar's record,150,Annapurna Post,Negative,7.71,2082-03-10
296,Naresh Magar promises to transform employment in 100 days,52,Nagarik News,Positive,9.29,2082-03-16
297,Ramesh Niraula unveils comprehensive corruption manifesto,17,Nepal TV,Positive,9.15,2082-03-08
298,Lekh Sapkota holds press conference on governance agenda,114,Nepal TV,Neutral,3.36,2082-03-10
299,Critics question Tara Khadka's stance on corruption,134,Deshsanchar,Negative,7.7,2082-02-28
300,Election Commission verifies Naresh Bohora's credentials,175,Nagarik News,Neutral,9.22,2082-04-03
